index,post,labels
331,"Abused as a child. I was abused by my parents as a child, and I currently still live with them as an adult, because I don't have a choice. The authorities have been contacted on them before, but the authorities didn't believe me (I have no proof of the abuse), and they just dismissed me, and basically told me I was being a bratty, ungrateful teenager to my well-meaning but imperfect and loving parents. My parents bullied and emotionally manipulated me into dropping accusations against them, and they successfully manipulated me into believing I'm their abuser and they're my innocent victims, and I tearfully apologized to them. I hate myself for letting them do that, but they threatened my safety and possibly even my life if I did pursue legal action against them. I'm being pretty much forced into staying silent about their abuse, and it's killing me. This is the only place I can talk about it. I currently can't go to counseling. My parents are also trying to prevent me from moving out. I want so badly to get a restraining/no-contact order against them both, but I have no proof.",indicator
332,"Three Days Changes Everything. I've been four months without self harm, until this weekend. It started with an old trigger, then every little problem, every panic attack I had learned to power through, ended with my harming. I swore to my family I could stop, I swore to the love of my life I would stop, I told myself I would stop. Now after four months I'm self harming again. What the hell makes them think this won't end badly. I'm bloodying myself up now, it's a matter of time before I kill myself. I should do it now and save time.",behavior
333,"someone blow my head off. im fucking done. i always fucking wonder what people would think if they saw the real fucking me. I always see people who fucking cheat and mercilessly get bashed for it. i fucking deserve death, im tired if these stupidass ignorant people. please kill me before i hurt someone and i still have a conscience.",ideation
335,"Why was I born. My whole life I've been a failure. I've failed as a son, a brother, a boyfriend, a father, a employee, a friend, a grandson, a nephew and most recently I've failed twice in the last 4 days to end it all. I can't look my girlfriend in the eyes let alone find the courage to ask for help. I realized I haven't looked in the mirror in years because I can't stand the person looking back at me. Dont get me wrong I've looked at my clothes or my new haircut but I can't look beyond the surface. The facade I've built up is that of strong man and I'm so afraid to admit that I'm no longer him that I've shut myself out as much as everyone else. I haven't been to work in 4 days. I haven't even gotten out of bed. My girlfriend thinks I hate her because I can't find the words to tell her I want to die. My son who i lost custody of last year must wonder why his dad isn't there for him anymore but I don't think I can bring anything positive to raising him. My work must wonder whats happened to me, I just dissapeared without explanation but I'm guessing they've now given up on me like I gave on myself years ago. I drink, I smoke and I sniff my pain away because those are the only times I don't completely hate myself, but when I get a moment of clarity i despise myself even more. Yesterday I took 2 dozen muscle relaxers and 4 dozen pain killers i honestly hoped I wouldn't wake up this morning but here I am a failure once again the worst part about it is as scared as I was I was content in knowing that if I was gone I wouldn't be able to let anyone down again.",attempt
336,"Why did I have to get such a horrible life compared to my peers. And of course I can't consoling about it because I know some Petersonain victim blamer is going to come here and tell me to work harder; even though I am doing all the right things. My life sucks solely because of factors outside of my control. Life for many is nothing more than a total curse and for others it is paradise. We are working longer and harder for less and less all to satisfy endless Billionaire greed. A factory worker in the 50s-70s had a higher standard of living than a young professional does now. Being a Man it is hard for me to find love and I am attacked for dating to have standards (just want a fair deal (and no I am not talking about looks); I am not asking for some blonde hair princess). Women can valuation and offers while a Man has to do all the work (yay equality amirite /s). I've been bullied, harassed, treated like shit my whole life. My parents won't accept me for who I am because I do not believe the harsh faith I was raised and have no way out cause I don't have a loving partner to go to. And I have other issues with them. You try living through South Asian Muslim culture (even in the west). I have nothing but whenever I complain I'm attacked, victim blames, and some sociopath out here is going to kick me when I am down. 99% of your life is luck; that's one thing I'm sure off. Hard work and all the rest can make some improvements on the margins but luck is the core determinant",indicator
337,"I'm feeling suicidal about my parents getting to know about me drinking and smoking. Yesterday I was caught in my dorm room for possession of 2crates of empty alcohol bottles and 10gm pack of weed. Note: both are prohibited in my dorm. I am scared that my parents will get to know as the management will send a letter to them stating the possession of alcohol and supposedly me being suspended for a temporary duration. I am not able to deal with what's going to happen , I am getting panic attacks and I'm not able to sleep properly ,my suicidal thoughts are getting more and more , I feel like a burden to my parents and everyone around me , I feeel the only escape to this situation is suicide , I don't know what will happen , I am going to get to know what is the decision of the management today.",ideation
340,"Things aren't getting better and I don't know how much longer I can last. I just don't know how much longer I can hang on. I know that I shouldn't be like this but, I can't. Nobody really liked me when I was little. I was constantly bullied and even most of my teachers encouraged others to abuse me. My mom hates me and made it clear that she loves her boyfriend more then me, since she always threatens to get rid of me whenever we argue. The people in family who loved me, friends who like talking to me and even a handful of teachers who actually believed me, are gone now. Those friends have disappeared, those people in my family are dead and, there's no chance of getting those teachers ever again. Not to mention, my other relatives and cousins forgot I existed long ago and they didn't even like me. As you can see, most people want me dead. Through all if this, I'm lucky to have found two friends who do care about me, for whatever reason. Though one of them might be dying and the other one is always super busy (I don't blame them for it. It just sucks that we can't do much). However, they're both doing online school and I don't have anyone else to talk to. Neither of them exist during the week so it's just me. I don't mind being alone but, I need to be completely alone to feel be okay. When I'm alone and around people, only bad things happen to me and my thoughts aren't kind. I really can't get that though. Considering I am only a senior in high school and I'm on the younger side so I have a good year or two before I can do anything. I know I need to be away from the people surrounding me but, like I said, I can't do anything. I tried going to the school but they made things worse. My mom doesn't care enough to put me through therapy (well, as long as she can't listen to what I say and what I say. Which is obviously something a therapist can't really do, since it's not allowed in their job). I would do it myself but I don't have money or a job. Things wouldn't be so hard if my mom and her bf didn't make fun of me for everything I like and do. God forbid I make them aware of my two friends, they'll drive them away and lie to make them hate me. I know I'm not perfect and have made mistake but, constantly pushing my friends away isn't fair. I don't think I deserve that. As you can see, I don't have much to live for. I love my two friends dearly and I'd hate to put them through that but, I just don't know what else to do. Living a whole year when you know you need help and that something's wrong with you, is unbelievably hard. I honestly didn't think it would get this bad. I promised myself that if things don't get better. I can kill myself on graduation night. Even if I do live that, I still don't want to attend graduation. There's nothing there for me and nobody wants me to be there either. I don't even want to be there. I just really want to stick some knives through my stomach and be done with life tbh",behavior
341,"It's settled. I've spent the past few days researching tall bridges in the place I'm staying (I'm on holiday), and looking for any further help anywhere I can. It doesn't seem to exist, not for me anyway. Decided to push through the holiday but commit when i get home. I have a few methods to try, I've already drafted my suicide notes. It's settled. I can't anymore.",behavior
342,"I'm free. It looks like I'm finally free to end it all. For years I felt like I couldn't kill myself because I had to ""stay alive for"" my friends. Well, I don't have anyone worth staying alive for anymore. Looks like I'm finally free to commit lifen't. This is a blessing. Finally moving forward and looking into my options to end it all. Of course there's always the possibility that I'll opt not to go through with it, but I need to have the option to end it all. So, with those obstacles out of the way, I'm free to get cracking. I'm looking into my options, getting my ducks in a row, and once I'm ready to end it, I'll make my decision. Live or die. This is a weight off my chest. It could finally be my time. If I decide to end it I'll be sure to wish you all a farewell. Goodbye for now!",ideation
343,"How the fuck am I supposed to get better for myself when I want to kill myself?. Seriously? Do people not understand that I can't just go from. 'Wow I need to kill myself'. to. 'Wow I really want to take care of myself and help myself' overnight?. Like what is this fairy land? Fuck. 'Get a therapist' yeah when you're constantly suicidal, helping yourself isn't really much of an option you consider. How the fuck am I supposed to develop some positive outlook from a therapy office when I am not even in the proper perspective? It's all bullshit. People like me are sick. I should be allowed assisted suicide. It's twice as worse to tell me to stay and suffer.",ideation
344,Gonna end myself soon. Have 1g of Benadryl and 1g of Prozac to OD on,behavior
345,"I'm Lonely. I don't know why but I'm constantly feeling alone. When I was in kinder I was always bullied and I didn't really make much friends. The neighbors that I had before were my playmates, but I always felt that the only reason the play with me and brother was just for my brother. All throughout grade school no one didn't really want to be my friend. Then high school came I thought I was finally making progress, but the friends that I made just drifted away. I usually have fun with my cousins but even then I feel like I just don't fit in like they would just be better off without me there. I feel like an inconvenience for the people around me. Right now I only have 1 close friend and she was my teacher. I've had a knife to my wrist 3x in my life and each time I couldn't cut. I kinda feel like a coward for not going through with it. I constantly imagine my family seeing me dead in a pool of my own blood. I can't talk with my mom about this because she views people who kill themselves as weak. My siblings have often told me that suicide is never the answer but I feel like I just need to do it. I'm sorry if this was too long a read.",attempt
346,"I have done fucked up stuff. I am not entirely a good person. I really need to feel loved- is that possible?. If I told you everything I have been through and everything I have done to others, is there any hope of still being loved despite it? I would like to feel that before I kill myself.",ideation
347,"Fuck life, I'm out. This world fucked me over and the feeling of knowing that your entire life will be filled with misery and pain is the worst feeling I've ever experienced in my life. I'm not motivated to do anything, my grades are dropping because I have no motivation and I'm always overthinking which makes me forget about my assignments or just makes me incapable of doing any work. I just feel like none of my friends like me, I'm the one trying to keep the friendship in tact but  it seems like no one else is trying to make the effort. I feel unwanted and I don't have anywhere else to go, I can't tell if they hate me or I'm overthinking but all I know is that I'll never receive the attention or commitment that I give to anyone. I can't tell anyone how I'm actually feeling because I know that it would push them away and they couldn't help in the first place. I've always had a solution to my issues when I was younger, like putting a bandaid on a scratch or finding a way to get out of detention. Now instead of a scratch or schoolwork it's the thought of suicide. You can't fix that shit.",ideation
348,"To anyone that might read this. During lockdown here in Denmark, we had a long winter. I've always felt I've never done what I set out to do and never really connected with people. The lockdown and cold winter put everything that much more true. I've never felt as alone as I did there. I was very depressed, bored and lots of anxiety. Couldn't sleep, woke up multiple times at night. At some point my thoughts came to what if I wasn't in this world. Perhaps I would gain peace? These thoughts scared me. It made me realize I was on the verge on becoming suicidal. Never really thought I would act it out. That's the summary of what I'm about to write. Honestly, there is so much more to life than what you and me are seeing. Life can be very beautiful and even more so to the ones that's suffered so much. For anyone that's having suicidal thoughts, I highly recommended you listening to the book: the power of now.",ideation
349,I think i'm gonna try to end myself again tonight. 15m. Hi. I think i'm going to try and end it tonight again. Probably by trying to overdose. I'm sorry. I'm just really depressed and sad atm and idk what to do. I have been crying basically all night and now this morning.,attempt
351,"Run out of options / about to lock myself in the bathroom to do it. I've hit rock bottom . I'm ready to do it . It's currently 6 in the morning here in the UK and I'm about to lock myself in the bathroom with a knife and some pills . I'm a 19 year old male university student studying architecture and planning . I've suffered from depression, severe anxiety and social anxiety for quite a few years , but have never been diagnosed or seeked help or spoken to anyone about this . I had a mental breakdown in spring 2019 just before my A levels but somehow managed to get back on my feet and complete my exams and no one knows , it was such a painful time . Things were going well during first year until April 2020 when coronavirus hit , a mixture of severe anxiety , depression and stress caused me to be completely overwhelmed and not hand in coursework which resulted in me failing first year and having to retake it again . I feel like a complete failure , everything had been going so well . I haven't told anyone about this and have moved back to my uni house and acted normal with my uni friends during these last few weeks as if I'm still hoping to continue to second year . But I feel so horrible and fake , I act so normal and put a front around everyone not knowing how I've fucked everything up pretending everything is still okay , I have high functioning depression so ive learned to hide all of this really well . perfectionism paralyses me into trying to be good and act without fault around everyone  all the time . All of this is too overwhelming now. I can't bear the thought of having to retake a year and end up been behind all my friends let alone the shame and overwhelming thoughts about them and family finding out and also what the future holds . This has been the last straw for me and suicide is on my mind . I feel awful because I don't want to do this but I've run out of options . Furthermore my brothers and my 20th birthday is only in a couple of days , which adds to the pain . I'm so scared I've never done anything like this before and I'm so scared of the pain I will cause to my parents and family . Thank you for listening and I hope I can get the peace i need .",behavior
352,Even when the 'fog' has lifted I still have no interest in modern life. I get windows of relief which is nice.but yet suicidal thoughts constantly round and round. I probably contemplate method over 100 times a day. What's really worrying is I'm 26 now and each year has got worse yes there's lots of factors but there's levels of depression I didn't think we're possible. As you all well know,behavior
353,"Please help, I'm at my rope's end. Basically,. I was sexually assaulted and my family, not listening to me, forcing themselves  on me makes me feel the feelings of being sexually vulnerable and sexually, triggered. And I hate it so much,. So fucking much. And I want nothing more than to be fr. But I feel like I'll be here for a long timer. I gotta return to their house through Jan 19th. And I want to be saved. I've been trying to save myself. But I know no one can save me. I feel so trapped, surrounded by these feelings and the people who put me through it. Feel like I have no choice but to lock myself in a house with a mom who's become religiously insane, coddling my Autistic sister. The helplessness I feel in the situation brings up the lust feelings. I jsut want to die. Then there's the whole layer of more ""normal"" trauma. My family treated me like shit. My mom made me buy a car while I was working a shitty min wage job, and after I got in a few accidents, car insurance. Because even though I was trying to work to pay for my dental treatment. My sister, who was coddled, never went to college, had a shit 3 hour a day McDonalds job. And her feeling minimally useful and getting money to spend on Ebay mattered more. So I have to fuck my life and mental health in this job over for her sake. My feelings are never listened to. The minute I get the least bit burdensome my mom expresses she is hurt HURT how dare her daughter betrays her!. I SURVIVED MENINGITIS , LOST MY RIGHT EAR WHILE I WAS AWAKE. WHAT DOES MY MOM SAY WHEN I EXPRESS TRAUMA. ""Relax, you thrived"". ""Don't blame your father"" It was totally all his fault. ""Imagine being the mom of that child! "", said to my nephew KLIKE SHUT THE FUCK UP THIS ISN'T ABOUT YOU!. She brushed me aside wwhen my older sister's boyfriend was being an abusive shit to me and my nephew and helped my older sister enable him. There's just, sooo much. And at school, I'm just surrounded by radical left SJW culture (I'm moderate left) , and just their habit of blaming things on big groups of other people (""You're white, this is your fault, you should feel guilty, go educate yourself!"") They don't get how toxic that is, and I'm just, older than a lot of them so my perspective makes no sense to these kids who are in this bubble. I never got to live that normal life and my family made it ten times worse. My mom lost her job, maybe if my dad hadn't fucking retired so early, completeely, I could have still gone to college then (By the time my mom found a new job, she just asked me to drop out of the college I was set to go to, she didn't feel ready to support me). I was loyal and did that. &amp;#x200B;. And suffered through all of this hell because of that decision",ideation
354,I don't know what to do. I feel like I'm a fuck up who can never get anything right. I feel like my mom thinks I'm a genuinely stupid human being who can't think for herself. I'm sitting in my car right now thinking of driving 100 mph into a tree. I want to tell a suicide hotline but I don't want to be locked up in a mental facility and never be able to get out. I don't know what to do.,behavior
355,"I did a horrible thing to the woman I love. We started off a bit complicated, my mum is dying from cancer and at the start I told her that I cant commit to a relationship because I wasn't in the right headspace. That was fine at first but she wanted more and so did i. But I was weak and looked for comfort in an ex. I put a stop to it again and again but everytime something got hard with my family I kept running to the other woman for support. I knew it was wrong and I hated myself so much. I hate myself so much. We were together for two years. But she found out about the previous incident and left. I am fully responsible for everything that happened. Im so regretful and sorry for hurting her. My mum is in her final couple of weeks, im her primary carer and I dont know how to process any of it. She will be leaving my little brother who is autistic in my care. I've struggled with suicide before. I was hospitalised for it previously. I dont see any future ahead for me. I am so scared that once my mum passes I will be joining her as well. I regret all the pain I ever caused and im so sorry for all the pain I will cause with my passing",ideation
356,"My mind is hell. After my breakup 6 months ago, I've been in a mental battle that I am losing. This will probably sound dumb but, you literally cannot get rid of love. Knowing that you still love someone who has already grown distant from you is painful. I've tried everything in my capabilities to get better. Talking my mind to everyone, Prozac, doing new things with myself, trying new foods, making new art, and so much more I can't even list them all. Nothing, nothing changes. My mental battle started with the memories, replaying of us in my head everywhere I go. The thoughts, the damn thoughts of 'if I only did this differently' or 'will he give me another chance?' Then came the dreams. They started out as happy ones, a time where we are still together, cuddling and goofing around as we used to. The thoughts started coming back again, but I was asking 'Why couldn't I have just been what he wanted?' 'I'll never be what he wanted.'. This had been cycling over and over, with worse thoughts each time. I started Prozac in December. As of the last few months, the god damn dreams have been eating my mind every night. I'm sleeping, yet I wake up even more tired of living. They're harsh dreams, of arguments or situations we'd have post breakup. Some of me hopelessly begging for him back, others where he has already moved on with someone new. They are merely dreams I understand, but in my state mentally &amp; physically, they tear me down every night. I feel so stupid for falling this low for a guy. I feel so weak, so hopeless against my head. I don't have much time left before I have to stop it. Nothing makes it go away. There is quite literally nothing there.",indicator
357,"I don't want to anymore. I hate cooking, I hate cleaning, I hate taking care of myself, all I have the desire to do is make money to pay my bills and maybe see my friends every once in a while. I used to have dreams and all that good shit and I thought this would never happen to me. But I tried making some art and I just got tired and exhausted when it ended up like shit. I used to love making shit. I used to love trying and experimenting and wasting time because it wasn't a waste to me. But capitalism and instant gratification has irreparably fucked up my brain. I don't want to anymore. It wasn't supposed to happen to me but it did. I don't know where I want to go and what future I may or may not have. I don't know anything anymore. I hope I'll get out of this soon. But maybe I won't. And that's life too. Is it alright to work a corporate job you're content with and live a mediocre existence? All my ancestors died for me to constantly contemplate suicide and be depressed. Would've been better for me to not be here at all.",ideation
358,"When to know if suicide is better. I've lived for years with trauma, ocd, anhedonia, no friends, abuse, and more since I was 12 or 13. I'm 20 soon and all I have is that. I'm not looking for sympathy or compassion really I'm just looking to know if anyone else feels like the release is better as their life is a bust. To say hey jesus or whatever I had an impossible situation can I go back?",ideation
359,I wanna go sleep. I have 58 pcs of 100 mg seroquel / 58pcs of viepax 150 mg and viepax 75mg I wanna go sleep forever can't take this shit no more I'm sick and tired of my shitty life,behavior
360,"I want to die. I'm a mom and a wife. I work with seniors. I'm depressed and I'm miserable. I'm stuck in a loveless marriage with no way out. He says mean things to me, but he's depressed too. He has no motivation to get better, so I can't get better. My kids are growing to resent me. It's not fair to people to have to deal with me. I'm tired of being alive. It hurts.",ideation
362,"Tired of it. No point to anything in life with depression. I feel pain and i just want to end it. Im honestly just so useless I have to be the most useless pos known to mankind. A fly is worth more than i am. all they do is look for food and reproduce, i cant even do that. im useless.",ideation
363,"Hopefully I won't wake up tomorrow. But I will, as always. Christmas probably won't be happening this year, that'll probably get me depressed enough to attempt properly again. Tired of being alone.",attempt
