index,post,labels
786,"I'm not going to live past 18 Right around my 18th birthday my life turned to hell. My mom who I called the police on for attacking me now constantly stalks me trying desperately to get me back into her life. I finally started college and it's awful, everything's online and theres basically no way to meet people as a freshman. Worst of all my boyfriend who I was dating online for 3 months finally came to visit, and then broke up with me in the middle of sex because he said it felt wrong and now hes questioning his entire sexuality but said were never getting back together. He was the only person who ever meant anything to me. I cant get over him. God I just wanna slit my throat in this dorm room",behavior
787,Nobody cares I've been having suicidal thoughts because I thought I had a sinus infection and I went to work and I got them sick and I swear to fucking God if anybody dies because of me I will 100% without a doubt kill myself. I've been trying to talk to my friends but they don't give a fuck. They ignore my calls and leave me on read as soon as I ask if we can talk. Of course. I know I'm fucking negative and annoying. Its always about me and my problems. My own sister told me to fucking stop. Im going to end it.,ideation
789,Animated girls have become more appealing than real girls that’s how I know I’m a loser I’m a 21m and let’s just say my dating life is nonexistent so I’ve started looking at animated girls from games I play because they can’t reject me or hurt me because with real girls it’s just takes a major toll on my mental health but now I’ve been looking at animated girls for so long I wish I could date them because it’s just never gonna work with real girls,indicator
792,"Being in army for 3 more weeks, makes me very anxious and sad. I need job where i can be alone and make good money. I DONT HAVE FAITH INSIDE ME. NEATHER DEDICATION.  I need to get my shit together , im 25 years old, with couple job offers, but i have to be around people there, wtff is WRONG whit me?!?:-))",indicator
794,"If I get rejected from nursing school I’m ending it I have a 2.6 GPA and the average GPA that gets accepted at the nursing school is 3.6-3.8. It is my second year at community college and I am supposed to graduate next year.   I have wasted my time at college. I have put the bare minimum into my classes last semester earning a 1.97 semester GPA and I have made absolutely no friends. If I don’t kill myself I’ll live to being a virgin at 30 years old, unemployed living with my parents, and completely miserable. Love in this day and age doesn’t exist. Every good looking person can just download a dating app and hook up with whoever they want. Meanwhile, I would be ridiculed and made fun of for having no experience in my 20s. It’s over before it even began.   Killing myself is my only long term goal. Other people who are more qualified deserve to be nurses. I deserve nothing but death. I am a useless waste of space and I always will be.",ideation
796,hello i think about killing myself 24/7 because i am ugly i can’t sleep properly i do not know what to do,ideation
797,dead inside don't really feel like talking rn just need a fucking hug,indicator
799,"I'd choose the blue pill In this case, I deem the blue pill as living the lie. To be more specific, the dilemma this is about is wether or not you would choose to live in a simulated reality or not, if you know for a fact your life would be better there.  I have modified it a bit, if you could press a buttom to relive only great the moments of your life maybe even make some edits to make those moments better and forget the bad ones, and then die, believing this to be real and being truly content, never realising that you're a) about to die b) that all of it was a lie. Why would you ever not press it? It truly seems like the perfect answer to all of life's suffering.  I've considered looking into self-delusion as a means of achieving something similar. I've often tried to convince myself when attempting to end my life that whatever bad happened wasn't real and ""create my own reality"" so to speak, so that I could die content. Never quite worked out, probably is practically impossible :/",attempt
800,I’m really depressed and I need to talk to someone.  I’m feeling really depressed and lonely and really could use a friend to talk to. I feel like sobbing and hurting myself. I’m contemplating suicide and hanging myself. I’m thinking of trying it from a pulley system. Thanks. Goodbye if I don’t get back in time.,behavior
801,I need help I'm there. I'm at that point now where I want to just die. I've wanted to kill myself before but it's never been this severe. I have a plan. I just don't really know how to carry it out. I don't have access yet to the things I want to use to kill myself. I will in a couple days. I just want one person to tell me not to. My families dead. My boyfriend is abusive and drove my friends away. Now they're too scared to talk to me. I'm alone. I lost my job because of coronavirus. Everytime I call the domestic violence hotline I'm on hold for forever. I just want to die. I just don't want it to be painful. I'll get some opiods in a couple days so I can overdose peacefully. I'm just having a hard time waiting until then. I just want a hug. I want someone to GENUINELY tell me they love me and care for me. And mean it. Not say that now. Continue to say that for awhile. Because I need it.,behavior
803,"I do EVERYTHING wrong since I'm so STUPID and I'm SORRY. And it doesn't matter how much I apologise, nobody ever forgives anything. I'd like to move on but no one will let me. I wish I was dead rather than live with people's disgust of me. I know I'm stupid and I'm constantly fucking up. I'm perfectly aware of that. I'm TRYING my best not to be. But no one cares about that. They only care about my mistakes and spreading rumours and shaming me. I'm not even asking for forgiveness, please just IGNORE me if you hate me so much. But no, I have to get mocked every day for having the NERVE to go to college and have people see my face!! Well I'm SORRY!! OKAY! I'M SORRY!! I CAN'T GO BACK IN TIME AND FIX MY MISTAKES. WHY DOES EVERYONE ELSE GET FORGIVEN FOR BEING HUMAN AND I DON'T. WHY DO THEY ALL HATE ME? THERE MUST BE SOMETHING WRONG WITH ME. I SHOULD KILL MYSELF, RIGHT?? EVERYONE AT MY FUCKING COLLEGE WANTS ME TO KILL MYSELF. I CAN'T EVEN WALK DOWN THE STREET WITHOUT EVERYONE STARING AT ME SO FUCKING SNIDELY. WELL FUCK YOU TOO. I SWEAR TO GOD NONE OF THIS IS REAL. I KEEP MAKING MISTAKES AND FORGETTING THE MOST BASIC THINGS I SWEAR TO GOD MY BRAIN HATES ME TOO. I REALLY DO FEEL AWFUL ABOUT IT, I REGRET EVERYTHING SO MUCH I FEEL SICK, BUT THAT'S NOT ENOUGH. I SHOULD JUST DIE.",ideation
807,"It's NOT always OK to NOT be OK. It's not OK for someone to be NOT OK for theirwhole miserable life ""It's OK to not be OK"" does not apply to me or in my opinion anyone else who has been miserable and wanted to die since they were a child.",ideation
808,"i have no clue I turn 19 in a couple of days and I can’t even bring myself to be happy. I’ve struggled with this bullshit most of my life and have had many attempts over my teenage years, but idk if can do this anymore. I keep pushing myself to do these things in life that’ll eventually “make me happy,” going to uni and stressing myself half to death so I may one day have a job I actually half enjoy. I go back after Christmas break. I’m struggling financially. I applied for so many Christmas break jobs but was denied every one. I can’t keep living off ends meat and be happy at the same time. I just want it all to end, this thing called life is too fucking hard, I give up.",attempt
809,"""beauty lies in the beholder's eyes"", ""looks do not matter"", etc. IT IS NOT TRUE i don’t want to hear these words anymore it isn’t fucking true ""beauty lies in the beholder's eyes"", it is a shitty lie, a way to say that someone is ugly and to try to make you think that you are a good person   ""looks do not matter"", they fucking do why do you think that attractive people have a better life than ugly people? because they are attractive and not ugly  being ugly is so worthless i don’t know why my attempts all fail there is no hope to live i can’t be alive anymore i am hated because of my looks since i am 5, adults and children told me i am ugly at 5, children tried to drown me because of how ugly i am at 5, and everyday i still get told of how ugly i am attractive people will never understand this problem, i am alone since i was 5, i never had friends and have no ability to make friends because i am so ugly",attempt
810,Disappearing. I just quit my job today. I also deactivated my main Instagram and blocked some people. I’m considering overdosing or strangling myself. I’m a burden to those who love me and I can’t speak to anyone.,behavior
811,Coffee makes me so fucking depressed ,indicator
816,"I don't know if i can do this I have done laundry in forever. I just want to wear something soft and comfy. But i know that won't make me feel any better. Im hungry but not for food i could eat tons and not feel food. Im not hungry, im empty. I could sleep for days and not feel rested, assignments pile up but even if i do them nothing changes. Showering doesn't lift that burden of life. Neither does self care or being honest about my feelings. It's been more than a month im not used to depressive episodes this deep being this long. I don't know what else to do i feel like im rotting at my core i feel dead. I can't do this shit. Im so fucking tired. I've tried everything but i can't even cry. Being alive is so agonising but it's like killing yourself is just as agonising and its pissing me off. No part of me wants to be alive. I literally do not care at all. Self preservation doesn't exist in my dictionary. Im only here for 2 reasons, one, i fear failing again. And 2, it will literally crush my family. I just keep reading stories of families that lost someone and while it gives me all the more guilt and makes me feel guilty for even feeling like i do, i realize life is so fucking painful. I realize this shit is so lonely. I realize that life was never meant for someone like me. I'm so sorry for anyone that has ever had to know me. I'm a train wreck and I've fallen to millions of pieces. There's nothing left to salvage. I'm so tired.",ideation
818,your past self what’s something u would tell to your past self? and what’s something that your past self wanted u to do?,indicator
819,"I've Tried Everything I've tried everything multiple times and failed, I've been on three different medications at different doses, I've been inpatient, I've done partial hospitalization programs, I've done group therapy, I've done one-on-one counseling for ten years. None of it works. None of it changes anything. Why should I live in a world like this? Why are my parents so selfish to ask me to stay in a world that is ending? Is God punishing us by sending us these natural disasters and plagues and wave after wave of sadness and hatred? Why should I continue to suffer? I use to be able to see good things, but I can't anymore. I can't do it. I can't do it. I can't do it. I want to drown myself. God, please forgive me if I do, because I know my parents will be devastated. Because sometimes people just can't go on any longer, and I am one of those people.",behavior
820,"alone somewhere, I guess does anyone get that feeling when they are alone? I feel that my parents are very unsupportive, and nobody cares. my life is full of confusion, nobody is satisfied or thoughtful, and this world is full of shit. when I’m excelling in school, or help people, my parents don’t care, friends just laugh at me, I can’t open up about anything. Can someone explain what’s happening?    PS: on a side note, im 15, so don’t think I’m older :|",indicator
821,"tired of this bullshit i can never have a normal day. everyones always yelling at me, telling me im stupid, worthless, a failure. living is intoxicating me more than the thought of not living. stress from everything is killing me and nobody knows it. i just want to perish.",ideation
822,it's done I'm waiting to death. I at e all my meds and snorted drugs. I took a lot of para cetamol. it's ending for me,attempt
823,I have a 500 mg Tylenol pill in my mouth rn. I heard it can help with anxiety but im also thinking about taking more. I'm so scared. It's just one pill and I know it probably won't do anything too bad. Im just feeling super super anxious because of my back to back exams and driving test next week im worried about my dad yelling at me for failing for the 4th time. I get too scared during the test. I felt like im going to have a long streak of failure this month. Im feeling like a burden to everyone. Ive already attempted suicide twice in the past month. I just want everything to slow down. Its a fucning pandemic but everything feels like its going way too fast. My head is racing and my body is trembling. My breathing feels inconsistent. I dont know whats happening. My mind is fogging a little and I'm overthinking everything. It's just one pill. Why am I so scared?,attempt
825,"Feels like everything is dull and I have nothing I want to do in life I don't see the purpose in going to school, studying, graduating, and getting a job and living like that for the rest of my life.",indicator
826,I'm thinking tomorrow ,indicator
827,"Constantly thinking about it I think my breaking point is close. I am in therapy and I let my therapist know that I have had thoughts, but I really watered it down. I know exactly how I’m going to do it if I ever get pushed to that point, and lately everything has been kinda pushing me there. It’s like i go back &amp; forth in my head over it. I’m not even able to get my feelings out in this point because i just simply….don’t know. I don’t know how much longer I have.",behavior
829,Fuck being alive I find the holidays very triggering. Father’s Day triggered me so much. I made my dad a card and I stole it back bc I regretted it so much bc I don’t like him at all. And same with my mom her birthday is in a few days and I also want to return her gift. I am so sick of pretending to like people that have made my life a living hell. They’re not respectful of my boundaries and are abusive idk wtf to do other than continue to look for higher pay then move out. It’s a situation where it’s secretly abusive but everyone in the family is suppose to pretend it’s normal. I’m sick of this. I have zero support. My family is toxic. My friends don’t give a fuck. They just make jokes about me if I’m upset and gossip. All the other help out there has been a huge let down. I was so close to slitting my throat about an hour ago. If I feel this way by the weekend I’m killing myself.,behavior
830,I’m a creep please kill me I’m a 21m and I hate myself I’m a creep I havent acted on my creepy thoughts but they still exist and idk why they exist I just want to end this it all sucks and I can’t help it I just want to die and get this out of my head,ideation
831,"How can I die to get my family paid How can I die to get my family paid, like through life insurance or something open to suggestions.",ideation
832,"Please help I need ideas of what to do rn. I’ve tried going to the hospital but they didn’t admit me. I’m considering going to a different hospital to see if they’ll admit me, but idk if my parents will want me to. I’m just really not okay rn",indicator
833,"I think i want to get help But I'm afraid, i feel like there's a huge chance i have something like BPD and that scares me? Idk",indicator
834,All in my mind. All in my mind. All in my mind. Its all in my mind. But it doesnt get out :(.,indicator
836,Dont trust anyone My trust is -2000% you cant trust anyone thats what i learned today,indicator
837,"I'm sorry...I have to kill myself in the end I guess anxiety and stress is to much for me and I know things will not get better this time i already haven't been eating anything for 2 weeks bcs i dont have money to buy food and i dont think i can take it anymore, I'm at my limit with everything  I tried since I got positive messages from my posts  But I have no hope I know things will not get better my situation it's not something that it will get fixed by itself just with wishful thinking Life is to much for me right now and it just affects my mental health and physical health even more I cant even do the things I wanna do bcs of it ...anyway... so I'm sorry but I have to do this in the end.....",ideation
838,I am depressed and just want somebody to talk to I just want someone to hear me out.,indicator
839,People hate people with social anxiety I'm extremely pissed off and suicidal. Everyone is against me. I'm on a camping trip with my family right now. If I wanted to I could kill myself today because people are against me.,ideation
840,"What to do/prepare before doing in the deed? Like financial, SO, pets, house etc. Please do not respond with dont do it etc. I need genuine advice as to leave my SO behind the best way possible.  At this point i have the following things and input would be nice.  - clean way to die outside of the house - process of life insurance and the terms etc. since it will be a suicide and insurance for the funeral. I would like to leave her behind with enough money for a good while and perhaps a specialist. - prepared a photo and my funeral wishes including costs.   - unsure if i should leave behind a suicide note since she part of the reason i am doing this or leave that part out. ( too much info. Dont ask. wont answer. ) - unsure if i should prepare a seperate set of clothing to be buried in. - anything else i should arrange for my SO. - pets  I dont have a single family member alive so that is easy.   Thanks for the honest response.",behavior
841,"I’m so glad I have my best friend back I sunk really low and just stop being able to have proper conversations. I’d just ramble on and tell dumb stories about me doing extremely illegal and dangerous shit, or just stupid stories to make a stupid point or give life advice, or Id ramble on about how shitty people are or how much I hate everything. She stuck with me through everything, she visited me when I was in a mental ward on suicide watch, she stuck with me no matter how crazy I got, but we were distant. I finally feel like her and I can have long conversations again. We stayed up all night as kids just talking, and I missed that. But recently we spoke for three days and it was just like old times. I’m not fixed just because of that, but I just wanted to shine some light on something that made me happy. I get tired of talking about how much I want to kill myself when I think about it all the time, it’s kinda monotonous",ideation
844,"Friends Why cant I make new friends why dont people like me what's wrong with me, no one ever wants to hang out with me",indicator
845,"No point in living and ready to die I have fully accepted I'm ready to die. People keep saying it gets better and sure that's true. But it never ever gets fixed. It's always broken. I can never ever ever have a uterus, undo my past, won't have the same experience as others etc. Life is utter utter hell. Every single day and I've decided I don't want any of this anymore and I hope I die soon",ideation
846,"The only thing stopping me from killing myself is the thought I'd survive. I always look at cars driving past, I think about jumping infront of a train that goes near my house and the only thing stopping me is thinking it won't do the job.",behavior
847,"Killing myself, right now. My parents aren't home and it's the perfect opportunity. The pain ever ends. I'm sorry. Hanging myself with a belt. Thank you to the amazing people I've talked to on here even tho you guys had your own problems, it meant a lot. Goodbye and I hope to see you guys on the other side! ",behavior
849,"I’m so close I’ve almost gotten enough medication to overdose on it. I don’t think I can be talked out of it. I have ruined my body with cuts and scars all over. I think I have an addiction to it, but I don’t care anymore. Good luck to everyone else",behavior
850,"Goodbye Everyone. It’s time to end it Well, we’ve had a good run, but I think it’s time for the end. Going to try overdosing tonight. Hope you all have a pleasant evening.",behavior
851,My time is up! I feel pushed to make a choice to face death. I am certain now I might die from suicide,ideation
854,"I think I'll do it this year I'm ugly as fuck and stupid, too.   And lazy.   Fuck i hate myself.   I can't keep it up.   I think this year is going to be the year.   The year I pick myself up, go to the nearest Walmart and purchase a firearm to blow my skull to bits.  My blood and brain matter will splatter all over the window and headliner of my minivan.   I would never do it any other way.   Oh and fuck the mods here.",behavior
860,"Done trying I'm just done trying to be happy. Death is easier to obtain and will stop the pain more permanently anyway. I have absolutely no hope left, I can't be fixed. I want nothing more than death to rain down on me and I don't give a fuck how it might effect others in my life. I fucking hate every single person on this fucking planet but I hate no one more than myself.",ideation
861,"How to know for sure that you’re actually severely mentally ill? How can I know for sure without seeking a therapist? professional help where I live is v unreliable and poor cuz of lack of awareness about mental health issues, due to cultural and religious factors. so please if someone can tell me how I’d truly appreciate it.",indicator
862,I made a post somewhere and my parents saw it I pretty much said I get extremely angry and really want to kill someone sometimes. I didn't say anything about being suicidal but usually when I have these thoughts I think about it. So my dad asked me about it and I didn't really say anything except I don't know. I feel like people wouldn't understand anyways if I really tries to talk about it. I avoid it because people are always trying to fix you and give you advice and that's part of the reason I'm angry in the first place. I avoid it because I'm afraid talking about it is gonna make me snap and kill myself right in front of them if someone says one wrong thing to me and then they'll just think I'm crazy and overemotional and treat me like the bad guy which will just start the angry thoughts all over again. They said I posted some pretty serious stuff. I hope people understand now how angry I really am. I think about killing people and myself. That's how serious it all is.,ideation
864,god i feel so lonely ,indicator
866,"Thinking about bailing life I’ve been depressed for years, and it has flared up a lot for the past weeks and I do not know why. Life feels like a pointless drag, and I see no reason to continue it. I don’t have much family that doesn’t hate me, I don’t have many friends (if the friends that I do have read this, I appreciate you very much) and school sucks. What I’m thinking right now is that I’m gonna kill myself, but first I’m gonna mess around a bit because why not. If I kill myself anyways, my actions don’t really have consequences, right? I have one friend whose identity I’m gonna keep unknown, but they know who they are. They have the same mentality as I do, it seems, and I wannna help them out of it before I do the deed. I don’t know where I’m going with this, to be honest. I know I need help, but it feels like a lot of effort just to continue this shitty existence. I want to live, but I also don’t. Does anyone have any words of wisdom, perhaps?",ideation
867,"I got it all ready and planed out. See you on the other side, stranger. 24 Pain killers, 24 pills of heart medicine, 12 pills of blood-pressure regulators and a bottle of whiskey to wash it down. If it all fails, i'll stab myself trough the roof of my mouth.     I love you all. Please get help, for someone out there loves you. You have your spot in this world.        Goodbye.",behavior
868,"Seriously in my particular case suicide is the answer. I cannot cope anymore and I refuse to live an unhappy life full of regret. I don't care about painless methods anymore, going to buy a rope tomorrow.",behavior
870,"There is a pit in my heart, and it's all my fault. I cheated on my quizzes for a university course; just the one class, everything else I’ve done on my own. I spent last week panicking internally, now I’ve just been feeling dull, unmotivated and empty. But mostly I feel absolutely sickened by myself. I can’t even look at my parents in the eye and all the confidence I’ve built up is gone. I betrayed the values I stood for, told myself to not cheat again after doing it in my previous semester, and when things got overwhelming, I started doing it again. Yes, I’m afraid I’ll get caught. Yes, I’m afraid of what will happen. And yes, I’m afraid of what my family will do when they find out. The quizzes were on Canvas; I ended up watching online lectures posted on Canvas while doing them along with reading the textbook. It was the stupidest shit I ever pulled.  The fear and the guilt are killing me. I can’t focus, I can’t study right… I just want this all to end. My life is fucked, and my future is fucked. I’m a coward, a liar, and I can’t fucking take this.",indicator
