index,post,labels
1401,I think I will kill myself this month I just can't do this anymore. I gave life so many shots. Its not worth it anymore.,ideation
1403,I pray I'll die. ,ideation
1404,This is the only place I have to talk Sorry for posting so much i dont have any irl friends and quit contact with everyone i knew in the internet since i dont trust them anymore. I hope that I'm soon able to end my life and stop this all.,ideation
1405,"Suicide for the greater good I'm a 31 year old male. If everything goes as planned, Ill be dead this sunday between 2-3 in the morning. I feel like it's for the best. Society want's me dead for the greater good. I'm terrible at being human. I don't act human, or think human so what am I? I'm something society despises. I'm trying to explain it to family, friends but they just panic al little. I'm telling my doctors and they just give me meds. They also give me diagnosis after diagnosis: depressed, schizofrenic, bipolar,...It's like they don't want to listen to reason. So i need to die not only for myself but also to help society by removing myself.I don't know if I make any sense here, it's really hard to explain.",behavior
1406,"My only reason for not killing myself yet is ridiculous I don't know what to even do anymore. I'm at a loss here. Recently I've (17F) developed some health issues that have completely destroyed my life. No these issues are not life threatening as far as I know but only someone else who deals with it would truly know the toll it takes on you. I cannot continue like this. I have looked for hours and hours on the internet to see if there is something I can do to fix the problems. There isn't. I have looked everywhere and there is nothing I can do. I have also gone to doctors and none of them take the issues seriously. They say there isn't anything they can do and to just live with it. I can't live like this. I just can't. It's been months and I just cannot live another day like this. Everything I have ever wanted to do doesn't matter to me anymore. I truly can't do this anymore. I take joy in nothing anymore. I've been miserable practically 24/7 since this happened. The only reason I haven't killed myself... Literally the only reason is because I want to watch all the movies I want before I die. I love movies so much and there are things I haven't seen that I really want to see before I kill myself. I have been watching multiple movies a day because I'm worried that if there is an afterlife, there won't be TV there and I'll be really upset that I didn't get to watch all the movies I wanted to. I know this is a ridiculous reason but it's true.",ideation
1407,"I hate everything about myself. So I’m 22, I have a year and a half left of school. I changed programs so all my friends have already graduated. From the outside it looks like I have it all. I’m a varsity athlete, executive director of three prominent student groups, an honours student, and I’m one of the supervisors at my job. People look up to me. I’m a trans rights activist. I’m a disability advocate. I’m a hard worker and I look like I persevere through things.   However, I don’t.   I’ve posted before, my family is shit basically. That situation is still horrible. However in the span of 72 hours I’ve needed to get glued back together in emerge twice, and I haven’t slept because I’m laying awake dissociating trying to not kill myself. Nothing feels real. I spend hours laying in one spot thinking about dying.   My friends left me when I became their boss at work, my partner just dumped me because I have too much going on, I’m broke and my solution to not having money is to be a sugar baby but I feel filthy because I’ve been sexually assaulted and never dealt with the trauma, my ex from several years ago is saying I stabbed him (that never happened, he’s currently having a psychotic break. he sexually assaulted me and I dumped him. That was it), I was in ANOTHER car accident, and I failed a practical (frisbee, it’s a blow off course) because I was mourning the death of my friend who got hit by a car cycling in September. My bio mom told me she doesn’t want anything to do with my, my dad and step mom don’t want me if I’m trans (‘you’re a monster destroying our daughter’).   My life has always been hard. I’ve been verbally, physically, and psychologically abused for much of it. I’ve been sexually assaulted four times. I’m chronically ill with epilepsy, gastroparesis, and a rare blood disorder that has no cure and just destroys my body. My parents denied me access to doctors when I was a kid so my system is completely fucked up. I need surgery to repair some things and I just found that out. I keep pushing through but I’m so. So. Fucking. Tired. I can’t push through it anymore. My counsellor wanted to take me to the hospital yesterday but I managed to talk through things because I knew if I went to the hospital I couldn’t kill myself.   I took too many pills and I’m still alive. I got a little carried away with self harm and then didn’t treat it for a good hour hoping things would just end. I can’t do this anymore. I hate everything about myself. Nothing is good enough. I’m not good enough. I made a video saying goodbye. This isn’t my ex partner’s fault, even though it lines up with me being dumped (time wise). Did it affect things? yes. But it was more of a ‘final straw’ situation. I can’t bring myself to delete the video. I cant bring myself to think of the next 20 minutes let alone the next 24 hours.  My body and mind are a mess. My life is a rollercoaster I can’t get off of. I have nothing and no one. I already have someone who will take my pets when I die. I wish I could make things work. I’ve tried so hard. But nothing helps. Everything always falls apart. Everything I touch breaks. I wreck everything. It feels like everything is out of my control; so I’m going to take back that control. I can control my life: whether I live or die. I know that if I die, everything will be better for everyone. Why push forward when there are so many reasons to give up. I just want to go to sleep and never wake up.   These thoughts are all disjointed, none of my sentences flow properly; probably because I can’t focus and also because I’m just letting out what pops into my mind. My fingers are flying across the keyboard desperately trying to convey my thoughts in a last ditch attempt to talk things through with myself. No one can save me but myself, and I know that.",attempt
1410,"GET ME OFF OF THIS FUCKING ISLAND. PLEASE! I can’t take it anymore. I can’t take it anymore. I can’t take it anymore.  I’m done with this. Absolutely done with this. I DO NOT want to get better at this point. Will take the most painless suicide option please.   People say that I need to “work on” my depression. I’m sorry I can’t be a brainwashed bootlicking zombie like the majority of the population. I’m not able to work for the next 40 years. And if I can’t work, I can’t live. I have no value to society if I’m not working. *DISCLAIMER: I actually am working full-time right now. I just can’t deal with it anymore*  I want to be out of my parent’s hair. I can’t live with them forever. My autistic ass is so pathetic. I am missing or have an extra chromosome for sure.  I have no desire to see what this world turns into. We will probably see an even deeper addiction and dependency into technology. I know my mental health has declined steadily by being so sucked into my phone. I have no desire to see how things advance from here. There is nothing to look forward to in the future. I guess climate change if you want to watch the world burn like me.   FUCK. THIS",ideation
1411,"Life is so pointless to me when I don’t care about working,money,a life,a relationship, anything. How I’m I suppose to stay alive any longer? Everyday I wake up I keep telling me self I’ll just kill my self soon so don’t worry if your not doing anything in life, but you know what it gets worse and worse everyday since I’m to much of a wuss to kill my self. I feel trapped, I need help or something.   I can’t live like this for 50 more years, I never asked to be born into this to work all my life to slave away for some shitty pay just to live. I don’t even enjoy life even when I try to change my mindset on life nothing works.  Really don’t know what to say other then just feeling trapped in this life..",ideation
1413,"I don’t think I can do this I have been thinking these past few days and I just can’t cope with any of this . I could right now walk out my house , go to this cliff near the sea and jump. No one would find my body to be upset . I can’t think about things anymore . I just need to get the courage. I want to tonight , but I just don’t know if I could do it . I feel I’m terrible person and everyone would be better off without me .",behavior
1414,"A hidden wish I often wish that I can fall in love with someone and show them the side of myself that I don't show to anyone. But then I realize that I hate thinking someone could see that. I don't want anyone to see a bad side of me but at the same time I do want it. I want to be loved but at the same time it scares me to have someone care about me when I don't even care if I end up dying or not. I am in a endless loop of wanting to love someone and wanting to be alone for the rest of my life until I die. I don't even understand why I am thinking like this.... I never really understand my emotions. It not like anyone really understand them either. I am just a person who is unable to connect with the world no matter how much I want to. My relationships are just things that will end up disappearing in the end and I am okay with that, even if I get lonely. But I do wish that one day I could meet someone I don't want to leave my side... But for now I am just a indifferent person who is unable to feel like I am actually here in this world and not just waiting for my death to happen",indicator
1415,Anyone want to talk? Feeling very down and alone. ,indicator
1416,"Singleness: men vs women. Women: hmmmm, there are sooo many hot guys and I don't know who to choose! I get soooo many messages dating is hard guys :(((    men: CRIPPLING LONELINESS. CONSTANT REJECTION. CONSTANT HUMILIATION. RADIO SILENCE FROM WOMEN. JESTERING, TRY-HARDING, DESPERATION   I FUCKING HATE BEING A SINGLE MAN. I WANT LOVE.",indicator
1420,"I love my cats so much but I want to die so badly...  “It gets better” is an insult. It’s so minimizing and it’s not even true. I’ve been on all sorts of meds, been in all sorts of therapy, and it always comes back to this. Every day is stale, every day is the same. My job sucks, my apartment sucks, my brain sucks. No energy, no motivation, no money to change anything. I just want to check out. I didn’t sign up for any of this. People say suicide is selfish, but what’s even more selfish is bringing a child into such a terrible, grey, unforgiving world in the first place",ideation
1421,I don’t want to live anymore ,ideation
1422,Scary to approach but know he's in pain. I have a family member that I know hurts so much inside.  But is also so angry and scary to approach.  I want him to know he is loved.  I want to be there for him.  We all do. Life is hard.    .,indicator
1423,Why isn't there a easy way to kill myself? I've been depressed my whole life and people have tried to help me but I don't listen to them.,ideation
1424,I can’t do this anymore Everything hurts,indicator
1426,annoying to be ugly i haven't talked to people properly since i was 5 because somehow everyone hates me because i'm ugly and i've always just sat alone in my room because i have no real friends  people say i should get over it but then talk bad about me and say they would kill themselves if they were me,indicator
1427,I feel so lost ,indicator
1428,"Guess I’m back 7 months and I still can’t move on. I destroy every relationship I touch, I was stupid to think anything else would have happened",indicator
1429,No one in my family cares about me And my friends are always busy so I talk to strangers but I still crave love. It makes me suicidal knowing no one cares about me :),ideation
1431,"Losing the battle against suicidal ideation For the past week, my suicidal ideation has been totally out of control. I have held it at bay,because I know how much it would hurt my wife and parents... But it feels like I'm slowly losing the battle. Every day I spend hours curled in bed sobbing. All of my supports are pushing me away because they just can't take it anymore. Life isn't worth living.",ideation
1432,"Almost everyday I wake up and think about ending it. I grew up so messed up and I feel so alone. I think about taking my stockpile, or hanging myself with my flag or just taking a long walk until I find a bridge I can jump off. These feelings never go away",behavior
1433,"Is there a way to escape the cycle? I've been in therapy half my life for depression, (10 years) and they've only reaffirmed my initial beliefs. I've changed so much on their word, self sacrificed physically over medications that didn't work, reinventing myself too much and too far, leting myself be cheated and used again and again, but nothing changes. I've turned to philosophy and the pragmatics of some religion and wholeheartedly convinced myself a way of thinking to keep this thought process at bay. I'm the one everyone comes to when they need help. For a while, that's what kept me going. I always seem to have the right words and actions for others, but nobody has ever had them for me. I don't know if I'm just damaged beyond repair or why I can't think my way out, but I'm desperate for a suggestion. I hate attention, I hate that I'm making a post here, I just want to hear something new.",indicator
1435,"No women wants me(31). How can I accept that? What may sound like a polemical title of an incel, is just an ugly truth I struggle more and more to accept.  ""Everbody is attractive"". Thats what they tell you. They lie. I noticed throughout my life: some people have a lot of options, others a few and then there are those like me, that have none.   I know that, because I tried everything. I was never afraid of asking girls out, signed up on multiple Dating-Sites and visited Single-Events. Just to name a few steps I took. Nothing worked. Every Girl rejected me when I asked for a date. That a women showed interest in me, never happend.   This whole life feels like a nightmare. When you are already rejected for a date, you miss out chronically the mental and physical intimacy you need as a human to stay sane.   Beside of that. How can I accept that I am that man nobody wants? I just look back at my life at my life and it makes me so sad that I never experienced love throughout one of the most important times of my life.  It makes me so sad.",indicator
1436,"I’m gonna do it I’m most likely ending it within the next 2 weeks as long as everything goes according to plan. I found a way to end it that won’t give a hospital anytime to save me while I won’t be shooting myself. I most likely won’t be writing a suicide note because that’s what’s kept me from ending it in the past. I know my friends have access to my account but if someone comes looking please direct them here. They’ll likely be looking for my real name, Oakley, so please take this as a final wish from me, direct my friends to this post, I love them so much and would hate for them to not know what happened.",behavior
1438,i just want someone to talk to i honestly fucking cant anymore,indicator
1440,"If I keep repeating the same mistakes, then surely I deserve this pain? This is all of my own creation. I deserve no pity. How sorry I feel for myself is only another indication of how broken and dysfunctional I have become. I will never lead a worthwhile, normal life. Just disappointment and failure ahead.",indicator
1441,"How does the afterlife affect your suicidal thoughts? I have suffered from sporadic suicidal thoughts and depression for about a year now. I'm a 22 y/o male living in a Scandinavian country. I don't belong to any particular religion. But I'm very spiritual. And I know for a fact (no matter how much one might try to convince me on the contrary) that if I should die – there IS a afterlife. Nothing can change this truth of mine. I've been a firm believer in the hereafter and the spiritual nature of the human soul long before I ever knew was depression or suicidal idiation was.  Knowing life will continue, I would actually rather want to exit this life and move on the next one. But I know I shouldn't. And I also know it will never happen because I could never inflict this much emotional trauma on my poor unsuspecting and kind parents – as well as other people in my life.  But still, I want to go back to ""God"" (or your understanding of the source) and have nothing more to do with this world of darkness, challenges and despair. What should I do? Can anybody relate?  Also, I am afraid I will become a sinner of sorts or a bad person later on in life (even though I'm actually very compassionate) and that scares the crap out of my because I fear I might suffer in the next life. I'm not a Christian though. And when I say ""suffer in the next life"" I'm not talking about Heaven or Hell. Much less burn in eternal flames. I'm just concerned I won't be rewarded well for my acts and choices in this life if I continue living it and have the opportunity to make choices – so I might as well just kill myself right away and go back to the place of love and light from whence I came.  I miss that place soooo much.... and I'm starting to cry now! Oh, I need help!!!",ideation
1442,FUUUUUUCK I’M SO TIRED. Pretty sure I’ve posted in this subreddit multiple times in the last week. I’m so exhausted of not being able to feel a single emotion. I’m tired of living like this and lying to everyone I love. I WISH I COULD SCREAM AND TELL THE ENTIRE WORLD HOW I’M FEELING.,indicator
1443,"I Want to Die So Bad. I can’t stop crying. It hurts so bad. I’m so miserable and I can’t handle the pain anymore, I want to die so bad. I want to hurt myself so bad. I’m hyperventilating and having a severe mental breakdown and anxiety attack. I want help but I think I’m beyond it. I just wish I was dead. I wish I could stop breathing. I want a gun so bad. I wish I wasn’t such a disgusting worthless piece of scum shit. I wish I wasn’t so insignificant. I’m praying I’ll die. Once I’m alone, I’m going to try hanging myself",behavior
1444,"I see death as the only way out right now don't tell me otherwise. Yes I deleted my previous post because someone called me a crybaby because I'm fat and I want to die and I didn't want to edit my post too much so here's a new post, people keep bullying me on social media and on the streets and I buy expensive bags and clothes so I look more attractive, well people still treat me like trash since elementary school trough high school till now and I lost more than 40 pounds 4 TIMES and gained it all back every time, I'm sick of it, I'm sick of failing, I'm sick of having PCOS which causes struggles while losing weight and makes you gain weight easier and every time I successfully lost weight, I can't get below 221 pounds so I'm still fat, no matter how hard I diet and how many times I go to the gym and I have hair on places of my body where I don't want hair due to PCOS, I feel like a monster, my face is ugly, my dad has alzheimer's and thinks I'm his son instead of his daughter, he just tells me the truth I look like a guy and I'm ugly, my life sucks, I told my mom about this and that she shouldn't be surprised if I killed myself.",ideation
1447,4 attempts later I'm still here. Suprise suprise. I'm still here. The waking up after is the hardest part.,attempt
1449,"doing it next weekend i was planning to commit on november ninth of this year, but i cant take it anymore, im probably going to do it next weekend. without exaggeration, im in misery and agony every second im alive. i went from being feeling depressed every day to being in genuine misery everyday. i cant takw it anymore, and i dont want to either, there’s absolutely no reason i should keep living and nothing keeping me alive. i hope i die",behavior
1451,"I'm crying right now. Right now, I'm crying a shitload on the inside, I'm home with parents and can't do it for real obviously.  it fuckin hurts sooo bad. I just want to sleep and not wake up until tomorrow or not ever.  fucking hell, if I had the strength I would've kill myself right now.  I don't care anymore. I don't want help, just want to die.  I'm trying sooo hard to hide the pain but, if you see me you can tell the pain I'm in and I don't want to be alive right now. just sharing my story.",ideation
1452,"Just got cheated on and I don’t know what to do I’m a 22 year old female and I just broke up with my boyfriend for cheating on me during the entirety of our relationship. I’ve struggled with depression before but this feeling is different than before. It’s more soul crushing and bleak than anything I’ve ever felt before. I feel so alone and desperate and heartbroken that I just feel like I don’t wanna live anymore. I don’t know how to cope with these feelings either as this is something new. I just smile and act like I’m okay, but I just feel miserable and in pain inside. I just don’t know what to do anymore.",ideation
1453,"Why does it feel like I can't do anything right Like everything I say is wrong, everything I do is wrong.",indicator
1456,I’m not ok rn I just don’t wanna deal with it anymore. I hate my emotions. I’m so fucked up I just want to end it all. I want to kill myself. I can’t believe this is my life. Or why I am the way I am. I wish everyone would forget I exist so I can just go without feeling bad about it.,ideation
1457,I want to Sleep Insomnia has been disturbing me for weeks now. All I want is to sleep. All I can think of when I’m awake is how to sleep and sleep and sleep,indicator
1458,"Today im spending time looking at guns i can buy without a license or thinking what bridge I can jump off Wish i could do something more. So ye im feeling pretty bad, im tired and my problems are unfixable.",behavior
1459,Versus OD vs gun. I got it now. Fuck it. Y’all have fun.,behavior
1460,"i want to lay in bed until i starve to death or i want to just slit my throat wide open nice and fast if u don’t have money, looks, &amp; luck good luck in this cruel world",behavior
1463,"All most took my own life I almost took my own life today, following the death of someone close to me, I have completely stopped doing schoolwork, I don’t have the energy to dig myself out of this one, I went and visited friends today and that didn’t even help. I’m starting to feel like I’m a lost cause.",attempt
1464,"Toxic families can cause us great damages. I never had the best family. To start with, my parents were 15 when I was born. You know where this story will end up, right ? Doctors offered my mom the possibility for an abortion, but she refused. She prolly believed fairytales back then. Then when I was born, I always went through basic needs: lowest quality clothes to wear, cheap basic mobiles to use, a tiny room to sleep... All the other kids had the best lives and mine was (actually is) all about struggling and surviving. “Ur playing the victim”. I AM the victim. I am the victim of many things: parental negligence, poverty, inequality... It sucks when suicide is the only remaining solution. There’s no point in coming to life if u have a life like mine.",ideation
1466,"The only way to be happy is to live in denial I'm sitting in my car on break from class just hating my life.  I don't care about my major at all.  I simply chose it to get a job yet I couldn't even get a fucking job at ShopRite this summer.  If I can't even do that, why would I ever expect to find a full-time job in a few months from now? If I knew getting a job would be impossible, I would've picked some useless major that I may have actually enjoyed.  Everyone's seemingly got internships or part time jobs that they work while going to school.  The fact that I don't makes me feel like a damn failure, yet if I did, I'd probably be just as if not more miserable.  I have four classes today and can barely get through the damn day without nodding off in my car.   I have one friend at this damn school while everyone else has a group of people around them and boyfriends/girlfriends.  Every fucking thing reminds me of how much of a loser I am.  All that I have going for me is that I'm good at music and I'm somehow good in school.  I spent my 21st birthday alone doing nothing.  Everyone who used to care about me doesn't anymore and I do/don't blame them. My mental health has deteriorated over the past 3-4 years due to me getting cheated on and losing a friend in a car accident.  I used social media as an outlet and now everyone thinks I'm a fucking maniac, which I probably am.  It doesn't seem like I'll ever find love or even friends.  The closest thing to a sexual relationship I've had is my own father who molested me when I was younger.  My brother, the only person on this planet who gets me outside of my three friends I never see, moved across the country.  I'm stuck in this shitty town and my only way out is to get a job somewhere else.  That job will likely never come or it will be something I'll hate doing.  Everything's a god damn mess.  Off to classes for another five hours.",indicator
1468,Did you knew a person who commit suicide? How did this person behave before doing it? Was it obvious he will do it?,indicator
