index,post,labels
0,Never will find love. Kind of thinking about ending my life again. Work really has been giving me a mental breakdown from the past few weeks. Seems everything in my life is crap even me. I wish I was even attractive enough for someone. I hate being gay and I hate being myself. I want to go to a bridge and jump off.,behavior
1,I'm inconsolable. I'm going to die soon,ideation
2,I hate living. sometime i think about why i have to live until now just because two person fucked in a night. fuck,ideation
5,"whats the point of living. no really. is there any real reason to keep going that cant just be dismissed by ""none of it will matter when you're dead"". all the things that made me want to kill myself are solved and yet i still want to die because now im just left with the feeling that life is all pointless. for a year straight i was constantly thinking about how nothing matters after you die and how life doesnt really matter and even though nothing in particular in my life is making me want to die anymore i still have this feeling that i should do it anyways. but seriously why shouldnt we just kill ourselves if none of this matters and we wont remember anything at all after we're dead. this all just seems like a huge waste of time.",ideation
6,"I want to be gone tonight. I'm in so much mental pain, I want this pain to turn into physical. I want it to be over tonight, I don't wanna survive it. Please, I don't want it to continue, I can't handle it, I want it to stop. I hate everything, I need peace.",behavior
7,I'm just feeling sick. I'm just sick sick of being worthless sick of acting like every day was perfect sick of acting like I'm good when I'm not sick of putting fake smiles sick of feeling pain sick of waking up everyday knowing I don't have a purpose. I'm so sick n I just wanna die. It's the best for me,ideation
9,"There is no today, nor tommorrow. I dont have anything days are jujst passing me by, im watching through the window and the earth is moving but me? im in the same place, the day and night cycle keeps on going, and going, and going, and im stuck, stagnant. People do things, but why? they study, work, want to go somewhere in life, but where does the desire come from? I have never experienced that, never. Theres no space for me around these parts, no space. I think i have n incurable disease or something is wrong with my brain, i cant even relate to otehr people that want to shoot their heads off like me. Im damaged. I cant feel nothing ive been falling down this void for like 5 or 6 years and i havent cried once, just once. All i know is that i want to call it a day and kill myself for the sake of my family. Ive seen the way they talk about me and while its not malicius or anything like that its obvious they try to not talk about me. I think theyre gonna be better off without me, everyone is going to be better without me. Im too weird, my face is weird, my demeanor is weird. Honestly i want to die now, right now in this instant if there was a button i could press that would erase all traces of my existence i wouldnt even doubt it, id go for it. But these things dont exist, so either i run towards a cop with a knife or find a dealer with some opioids. i dont know, i wouldnt know, im damaged",behavior
10,"It's not working anymore. I'm a person with schizo-affective disorder. I haven't slept in weeks because all I see and think are people are going to hurt me in my most vulnerable situation. I'm deteriorating. I just want to get it over with. I'm not alone, but I can't tell anyone either. I refuse to be sent back to a mental hospital against my will. The only thing that scares me is the pain if I go through with it. How much it will hurt and how long it's going to last.",indicator
11,"When I encounter new people, in person or online. I always think to myself ""when will they leave?"". Such a fucked up way to feel about a person I barely even know but in my experience no one sticks around. everyone leaves you eventually. Especially the ones who promised they would stay. I start reflecting thinking hmm maybe it's me?. But then I realize I push people away unintentionally because I already have the mind frame of they will leave so it's more like ""let's get this over with"". and the ones who are reluctant to stay I don't necessarily give them a reason to. so shucks, I'd leave too. I'd leave myself if I could so I do not blame these people one bit for making their choice. It starts to hurt less. but at the end of the day, it still hurts.",indicator
12,"i am not ok. not depressed, but if anyone know anything about Erik Erikson, i failed all the development stages that are needed for my age. i am severely codependent, i can't think for myself at all, i need people to do everything for me, i have no sense of self, constant anxiety, self doubt, and mistrust, i feel really small, like a child. this is very unhealthy. i don't know what to do. i can't look for therapy because it is very expensive, and like i mentioned before, i can't do anything myself. i plan to kill myself at 21, whether i want to or not, i'm 18 now. i can see this in everything i do, in everything i am. i can't even talk, and i don't know what else to say because my brain is so empty, people h e to say everything for me. i am so apathetic and passive towards everything, i have no creativity at all. every relationship i have with friends is a parent-child type thing. it's not fixable, there is no hope, i wish there was a reset button on time, but there isn't. i feel braindead. time passes, and it's only getting worse the older i become, and it's gonna be too late to do anything. i should have grown up normally, not start when i'm 18 or even older. i can't do this by myself. i am supposed to be independent by now. not to mention the constant loneliness, because no one wants to be with a person like this. i always need approval and attention, it sucks. i've become anhedonic and dissoative now. i can't be alone, but i'm always alone, so i spend all day everyday on my phone. this is hell.",behavior
13,"I want to die. I don't like anything about myself. I also hate my job and my family. I have all my social media deactivated. I haven't spoken to anyone in months besides ""friends"" who only call me when nobody else will pick up their call. I don't see ANY PURPOSE for my existence. Nobody is getting anything out of this. I am not going to kill myself atleast not any time soon because I have given myself 5 more years just in case. Can someone tell me how to go about existing without feeling anything?I have prolly stopped making sense at this point. But if you can, please temme how because I am sick and tried of crying myself to slee every night.",ideation
14,"It just really bothers me…and I don't really have the guts to do it. I'm on placement at the moment for work, and once these 6 months are over, I do not know what I'm going to do with my life. I don't have the right skills, and I hate that you need references for jobs and you always have to be your best at jobs. I can't seem to do that, I've tried over and over again. Even an interview for me is a struggle. I don't think I can be in this cycle for any longer. For jobs, I'm never good enough and I do need money. I hate how everything is expensive and how housing works in the uk. I cry very easily, I don't know how to stand up for myself when being treated unfairly, I always do get treated unfairly. I hate having to get ready for work even. I'm stuck in this rat race and I feel like the only way out is suicide. I do have other issues, this is my main concern right now as I don't want to struggle with money. I'm just not smart enough and no one wants to give me a reference. I'm not very proactive and my memory is so shit. I have no interest in doing anything. I can't even talk like a professional, I've watched videos and observed but I'm just still not able to. I can't formally answer questions, there's always pausing and it's just so embarrassing. I feel so empty and feel like things are just crushing. I'm getting older, 22 right now and things are just getting harder and harder. It feels overwhelming. I am really scared. I've considered hanging, but I can't seem to go through with it. I post on this few times a month just expressing my thoughts and feelings and how shit this world is. I got belittled by a coworker yesterday. I can never form connections with people and I don't have any friends. I'm not concerned or wanting to make friends, but I feel like it has effect on me. I'm quite awkward and very sensitive. I think about how fucked up this world is…the nasty people, money, jobs, expectations, judgments, people killing people and I think I should just make my escape but I don't have the guts.",behavior
15,i already know i'm going to kill myself and i've decided on it. just a matter of when and how. but ain't no way i'm doing this shit for another year. i already got my suicidal notes ready.,behavior
17,"What are you hoping to gain?. For anyone that posts that they are going to kill themselves or are in the process of doing so, what do you hope to gain by posting that information here? In my opinion everyone that does so is looking for help and isn't really wanting to hurt themselves.",indicator
18,"No point in existing. When every thing you do and every word that comes out of your mouth hurts the people that you love there's no point in being alive anymore. I don't mean to hurt anyone. But it seems like every opinion i have, every piece of advice i try to give, just everything that i say or do or think hurts everyone. Im so tired of being alive. I just want someone to love me and accept me and its never going to happen. I want to be brave enough to kill myself but the past two times ive tried ive failed. Im so tired and sad.",attempt
20,"The rage from yesterday has died down. My desire to kill myself has not. Just a thought, but truly, what reason is there to live when what little motivation you have is ripped from your hands, or left to dangle from a string in front of you, just out of reach, teasing you, or brutally destroyed before your eyes? Like, these past few weeks I've done EVERYTHING in my power to try to stay afloat, and it's meant literally nothing. These past few weeks have been the hardest I think I may have ever fought, and yet the recoil from it has hit me in the face even harder. I try, and shit just gets more fucked up. So why bother? Why try when it genuinely makes things worse? And waste your energy in the process? I've attempted an overdose on twice within the past two weeks and three times within the past six months, and I promise you that THOSE experiences combined have been easier to handle than the bullshit I've endured these past weeks. So I mean really? Why try? What's the point? Killing myself is painful, sure. More painful than what I've dealt with though? I'm not so sure anymore. Even if there is a so called light at the tunnel, I don't care anymore. I just want out of that tunnel and if that means getting hit by an incoming train as a means to escape, I'd honestly choose that at this point.",attempt
21,"Help, very worried. I don't know where else to put this but i'm fucking horrified and keep crying and having panic attacks over thinking I have diabetes because I have some of the symptoms. This is also causing me to worry that maybe the diy HRT i'm doing (mtf) is a cause. I can't live without estrogen, i can't wait until i'm a legal adult. Then I think about how many fucking issues I already have and its just too much. I'm going insane what the fuck do I do? My parents would rub in my face about how they were right about me not eating causing me severe issues later on, I'm also scared of being seen weak around them. Please I'm so fucking scared.",indicator
23,"Society doesn't like me. People bully me in everywhere. Even on reddit I don't feel comfortable. Definetly something is wrong with me. But I don't know what. Everyday I am thinking about suicide everyday. Everyday I am trying to survive. I am studying learning watching videos daydream a lot. But nothing fills the hole in my heart. I feel lonely I feel like I am only watching other living human beings. I feel like I am on the moon. I am very unconnocted with this world. In the pas I tried to hide this with saying ""I am misanthrope"" but no I wish I could have friends who supports me. I feel like a creature.",ideation
24,"What's the use. I'm just about 22 and over the past 3 years I've dropped out of college and cut almost all of my friends off. I've only decided to keep living only so I wouldn't torment my family but I've given up in life and spend my time drinking and smoking which has made me gain 25 lbs. Haven't gotten laid in a year and a half. There is no hell so I'm not scared to die. I have a plan, note and date which will be in early April. For some life may end up getting better but  for me it doesn't. Good luck to the rest of you",behavior
25,"I plan on going to a hospital and checking myself in to a mental health institution, hopefully forever. The suicidal thoughts have just been too much recently. That and my anger is worse than ever. I'm like a rabid dog in a kennel but I look like I was drawn by a toddler with poor artistic skills given how many cuts I have all over myself. I'm constantly on edge and ready to explode at the smallest inconvenience no matter the situation. I legitimately believe this could one day lead to me being sent to prison because I hurt someone bad. So it's either I walk into an ER and tell them I'm going to kill myself and need to be checked into a psychiatric ward or I actually do go through with it and kill myself. I'm still debating on this and haven't even left home yet. But I think it's best for society if I just stay on the inside the rest of my days. I have no family anyway so no one would care or miss me. How am I gonna pay for all this? Who the fuck knows. I'll probably just end up dead in a gutter one day and get cremated like all the other nameless homeless people out there. But I don't care. If it happens it happens. My name's Ava. And this will probably be my last post ever. Goodbye.",ideation
26,"Im so tired i can't kill myself. I know a good clif but its around 4-5km, its possible to get there, i just can't commit to it. Im not special to anything or anyone or myself, there's no me at this point. I told someone that im suicidal, they know that if i hang out with them really helps me, but they don't do anything about, they insist that they care but i dont believe it, maybe its my brain playing with me.",behavior
27,i'm tired of everything. i'm tired of feeling this way. im tired of my life. im tired of hating myself. i'm tired of crying myself to sleep every night. i'm tired of being told to just 'be happy' and 'get over it'. i'm tired of being afraid of leaving my house. i'm tired of my parents always fighting. i'm tired of feeling disgusting. i'm tired of remembering all of the mean shit people have said about me at school. i'm tired of being ugly. i'm tired of asking myself why my life is like this everyday. i'm tired of not having friends. i just want it all to stop. i wish i was never born. i have nothing going for me in my life.,indicator
28,"Depressed. This month has already been a shit show, texted my mom I think I need to be on anti depressants and she just said 'schedule a doctors appointment' not 'are you okay? Do you want to talk?' I can't wait to fucking kill myself and have all my fake ass friends and shitty family go to the funeral. It's gonna be one last big fuck you",ideation
29,"I'm ready. I'm finally ready to just end it all, I'm gonna wait a few weeks but I already know how I'm gonna do it. I'm not gonna tell anyone either, all ready tried that before and no one really understands. So goodbye everybody, I doubt anyone will care.",behavior
30,"I've been a burden my whole life. I've been a burden my whole damn life! Title says it all!. I was supposed to be so much more then this! 17 fucking years old for what?! I'm a disappointment, I've only burdened my parents. They hate me anyways. I've stayed on this damn earth for my siblings but fuck they'd be better off without a person like me!. I'm everything wrong with the world! My existence screws up everyone's lives I've ever come in contact with! I can't even fucking kill my self. I hold the blade but can't fucking do it for what! I should be able to!. It'd be better off for everyone if I did it. I try so hard to be only good and radiate happiness but my past is still there. I'm still just a burden. I can be as kind as I want but they'll always see me the way I am. Nothing.",behavior
31,"Life's not about being yourself and being unique, it's about catering to the interests of others and stripping yourself of individuality and playing within their comfort zone. If there's anything i learned about life, it's this. Seems my family doesn't like a depressed 16 year old, but doesn't even deal with him. Well shit how about i die then, is that what you ask for?. People love plastic, and people love plastic people.",indicator
32,"There is no hope. All is lost. I have this on my computer wallpaper now. It is my daily reminder that killing myself will happen. It is now 100% confirmed that I will be taking my own life. Nothing anyone can do or say can save my life save for someone putting $1,000,000 in my bank account or if I were to win the lottery. When it will happen I am unsure, but I do know that I will not live to see my 40th birthday (which is in 2023). It is pointless, meaningless, and a waste of energy to even keep trying. At least I DID try.",behavior
34,I'm too weak to get rid of toxic people. My best friend hurt me severely and is currently dating my ex. I've posted on Reddit about it and everyone's advice is to kick them both out of my life. I tried at first but we live really close and have an interlapping friend group so I've started seeing him and playing video games with him and stuff. I told him last week that he had two weeks to make things right. It's a stupid ultimatum that I know I'm not gonna be able to stick to. I just want things to be normal and have someone to be friends with. But I know it's never gonna happen and all I'm doing is embarrassing myself and showing how weak I am. I just want him to understand how shitty he's being. He's said he feels bad but won't break up with her so he's probably just trying to keep me around so he's not lonely when they break up. But I know I'll just forgive him and continue to be used by everyone I know. I'm pathetic,indicator
36,"I'm losing my mind. I'm having a complete breakdown and I just want to end it. i hate myself i hate my brain i just want to put a bullet right through it i cant take it anymore im tired of being alone, im tired of feeling worthless im tired of failing everything i do i dont want to be here anymore someone please murder me becasue i dont have the balls to take my own life i just want to die i hate being alive i just want to die i hate being alive i just want to die i hate being alive i just want to die i hate being alive i just want to die i hate being alive i just want to die i hate being alive i just want to die i hate being alive i just want to die i hate being alive",behavior
37,i'm on suicide watch. i really wasn't made for life. i could take a bunch of pills while everyones asleep but honestly i'm just too scared. i don't want to die in pain. i don't want to make my mother sad. but i can't keep doing this it's too much ive been just getting by for almost twenty years and have made no progress and have accomplished nothing whatsoever. it's too painful. i loathe myself. subjectively it would be better if i was dead. i contribute nothing LITERALLY nothing i we never had a job i can't drive i have no talents all i do is lay in bed and be sad god i wish i could just fucking end it,behavior
40,"I hate myself so much. Overall I'm terrible. And I know I'm objective because there are some good things about me, I have a few talents and positive traits. But mostly I'm awful and shouldn't exist and I hate being alive. My life is so disgusting and pathetic. I am such a sad and stupid person. God I wish I was never born. I hate everything. Just the idea of someone knowing what my life is like makes me want to kill myself. I want to kill myself so badly. Where are all these serial killers kidnapping girls? It seems like something could be worked out so that instead of normal happy girls being slaughtered, people who want to die can. Some people are just true wastes of life, and I am one of them. 7 billion people on earth, not all of them can have worth. I wish I had the guts to jump in front of a train so I would be in pieces and you couldn't even tell it was me. And then me and my body would be hidden from everyone. God I am so fucking terrible. And the fact that I'm writing this and the thought of anyone ever reading this knowing I wrote it humiliates me so deeply. I'm so fucked in the head, I just want to crawl out of my skin. And what bothers me more is that if I did kill myself, people I know would pick apart my life to see why I did it. And they wouldn't have to look far. 'Oh my god I can't believe it' would turn into 'oh wow, that's so sad' when taking about me. Not that there are that many people who deeply care about me, for most it would be surface level and then they would go on about their lives since we're not that close. Idk what the rules are here but please don't try to convince me that I'm wrong. Someone want to push me to go thru with it? It's looking pretty good but I'm a coward and don't know how to deal with end of life stuff (my belongings, my phone, etc)",ideation
41,I want to kill myself. Fuck me fuck me fuck me fuck me fuck me fuck me fuck me fuck me fuck me i cant breathe fuck me fuck me fuck me im useless fuck me fuck me fuck me everyone would he better off with me dead fuck me fuck me fuck me.,ideation
43,Recent dental events made eating not fun anymore. I (M23) found out recently I was grinding or clenching my teeth to the point where my back molars look sort of like a y=x^3 graph and now eating doesn't feel fun anymore because I'm worried that it will make my teeth worse. I went to my dentist and said that giving me a night guard is all they can do. I feel so ashamed that I'd let my teeth get to that point. It's mainly because I got too lax on my hygiene because I haven't cared about it when I was more depressed. Now I'm paying the price and the suicidal feelings are coming back. The teeth are in constant pain and it hurts to eat even soft foods. Any dental advice is welcome if anyone here is a dentist.,ideation
44,"If you could help. Could one of you help me? I just need to be able to buy basic necessities stuff for me and my dog. I know this is not the right subreddit to post this stuff but in fact i'm someone who wants to die and that is one of the reasons i'm not within the rules for posting to the correct subs. If you want more information and are interested in helping, I can explain it better in the chat.",ideation
46,"It's been 10 yrs of the worst of this hell, 8 yrs of constant attempts but obv I wasn't trying hard enough. enough is enough. This Friday, May 14, 2021 is my suicide date either that day or before it (doubt ill make it that long). currently waiting to see my psychiatrist who I don't trust anymore as I TRuST NOT 1 SINGLE soul in this entire world anymore because of long history of trauma/ptsd and shit but then bc of trauma from a few days ago that literally I told all the 'professionals' about and they didn't care btw it was them fucking me over (cops physically and verbally abused me, and I told the hospital staff and they didn't care and just watched them continue to do it and took part in some stuff too) I'm fucking done. only reason I didn't die last night was bc I actually wanna live if I could get the help I need right now but bc of my city and it's healthcare system and workers and how they view me bc of how much I struggle with sh/suicidality they just treat me like shit or are done with me. I just hoped I could get some comfort if there was any left with my psych before I end thing v v soon. save some flowers for me please? I like lavender",behavior
48,"being fat makes it that much harder to kill yourself. idk if hanging myself would even work, i might just break the shower or the door frame 😂 idk if taking these pills would work, it might be enough to make me sick but not die. I'm trying to die not end up brain damaged. Shits difficult 😎",behavior
49,"thinking about admitting myself?. If I go to the psych ward and I'm not panicking or I don't have a specific plan for killing myself, will they take me seriously?. Everything is so much effort and I want to die, but I'm probably not gonna do anything because I'm scared of messing it up. I'm just so fucking depressed and numb and sick of everything. I don't want to go and have them tell me what I feel isn't real. I don't even really want to go at all, but I also know its safe and maybe I need that right now? I feel like I can't even think straight anymore, I don't know.",ideation
50,every night i count my pills. and every day i wonder why i didnt take them all. why am i such a coward when im living a life nobody loves or cares for me in?,behavior
51,The thoughts have been so unbearably strong lately. Idk why but in the past few months my thoughts have been in a major downward spiral. Everyday waking up and making it through the day is such a struggle for me. I've been keeping this a secret from everyone recently since I don't want to end up in the psych ward again. I honestly don't know what to do at this rate.,indicator
